{
  "$schema": "https://json-schema.org/draft/2020-12/schema",
  "$id": "https://hyfib.com/tailor360/events/billing.invoice-posted.v1.schema.json",
  "title": "billing.invoice-posted.v1",
  "description": "An invoice was posted: numbered from its branch's financial-year sequence, given its barcode, and frozen. Published in the transaction that posted it, so a consumer that hears it can rely on the row. Carries identifiers and the figures a consumer reacts to — Payments allocates against grandTotal, Notifications names the invoice by its number — and never the customer's details, the lines, or the barcode payload, which is resolved by its own route (INV-BID-04).",
  "type": "object",
  "additionalProperties": true,
  "$comment": "additionalProperties is true on purpose. conventions.md section 5.5 permits additive changes within a major version, so a subscriber must tolerate a field it has not seen; a closed schema would make every such addition breaking. required lists the fields present when v1 was published — a field added within v1 is optional forever, because a dead-lettered message replayed later carries the payload as it was written.",
  "required": [
    "eventId",
    "occurredAt",
    "aggregateId",
    "organisationId",
    "branchId",
    "customerId",
    "orderId",
    "invoiceNumber",
    "grandTotal",
    "currency",
    "eventType",
    "schemaVersion"
  ],
  "properties": {
    "eventId": {
      "type": "string",
      "format": "uuid",
      "description": "Identity of this occurrence. Delivery is at least once; consumers de-duplicate on it."
    },
    "occurredAt": {
      "type": "string",
      "format": "date-time",
      "description": "When it happened, in UTC."
    },
    "organisationId": {
      "type": "string",
      "format": "uuid",
      "description": "The organisation the document belongs to."
    },
    "branchId": {
      "type": "string",
      "format": "uuid",
      "description": "The branch that issued the document."
    },
    "customerId": {
      "type": "string",
      "format": "uuid",
      "description": "The customer the document is issued to. An identifier and nothing more: the name and address on the document stay on the document."
    },
    "aggregateId": {
      "type": "string",
      "format": "uuid",
      "description": "The invoice."
    },
    "orderId": {
      "type": "string",
      "format": "uuid",
      "description": "The order the invoice charges for."
    },
    "invoiceNumber": {
      "type": "string",
      "maxLength": 40,
      "description": "The display number, INV-<branch>-<FY>-000001 (conventions.md section 3.2, interim format). Never reused; kept through a cancellation."
    },
    "grandTotal": {
      "type": "number",
      "multipleOf": 0.01,
      "description": "To the paisa, in currency."
    },
    "currency": {
      "type": "string",
      "minLength": 3,
      "maxLength": 3,
      "description": "ISO 4217, INR today (conventions.md section 1.1)."
    },
    "eventType": {
      "type": "string",
      "const": "billing.invoice-posted.v1",
      "description": "The wire name."
    },
    "schemaVersion": {
      "type": "integer",
      "const": 1,
      "description": "The payload's major version. Agrees with the .v suffix of eventType."
    }
  }
}
